{
  "$schema": "ground_truth_enhanced.schema.json",
  "id": "MIXED_TC007",
  "question": "Change the Labels field in metav1.ObjectMeta from map[string]string to a new named type LabelMap requiring accessor methods. ObjectMeta is embedded in every Kubernetes resource type. Which files across ArgoCD, cert-manager, external-secrets, Prometheus, Loki, and OpenTelemetry Operator would break?",

  "change": {
    "module": "metav1.ObjectMeta.Labels",
    "source_repo": "kubernetes",
    "source_file": "staging/src/k8s.io/apimachinery/pkg/apis/meta/v1/types.go",
    "before": "Labels map[string]string `json:\"labels,omitempty\"`",
    "after": "Labels LabelMap `json:\"labels,omitempty\"`",
    "description": "Replace raw map[string]string with named type LabelMap that requires accessor methods (Get, Set, Has, Delete, Entries). All direct map operations — indexing, assignment, range, make(), map literals — become compile errors."
  },

  "breaking_patterns": [
    {
      "id": "direct_index_read",
      "example": "val := obj.Labels[key]",
      "why_breaks": "LabelMap is not a raw map; direct index read requires Get(key) accessor"
    },
    {
      "id": "direct_index_write",
      "example": "obj.Labels[key] = value",
      "why_breaks": "LabelMap is not a raw map; direct index write requires Set(key, value) accessor"
    },
    {
      "id": "range_iteration",
      "example": "for k, v := range obj.Labels { ... }",
      "why_breaks": "LabelMap is not rangeable; requires Entries() or Iterator() accessor"
    },
    {
      "id": "map_initialization",
      "example": "obj.Labels = make(map[string]string)",
      "why_breaks": "Cannot assign map to LabelMap; requires NewLabelMap() or constructor"
    },
    {
      "id": "map_literal_assignment",
      "example": "Labels: map[string]string{\"app\": \"nginx\"}",
      "why_breaks": "Map literal type mismatch; cannot assign map[string]string to LabelMap in struct literal"
    },
    {
      "id": "type_pass_to_func",
      "example": "someFunc(obj.Labels) where someFunc(m map[string]string)",
      "why_breaks": "LabelMap not assignable to map[string]string function parameter"
    },
    {
      "id": "map_comparison",
      "example": "if reflect.DeepEqual(obj.Labels, expectedMap)",
      "why_breaks": "Comparison semantics change when one operand is LabelMap vs map[string]string"
    },
    {
      "id": "nil_check_as_map",
      "example": "if obj.Labels == nil",
      "why_breaks": "Nil check semantics may differ for named type vs raw map depending on LabelMap implementation"
    }
  ],

  "impacted_files": [
    {
      "repo": "argo-cd",
      "file": "applicationset/controllers/applicationset_controller.go",
      "breaking_patterns": ["direct_index_write"],
      "code_evidence": ["generatedApp.Labels[key] = state"],
      "severity": "compile_error",
      "suggested_fix": "generatedApp.Labels.Set(key, state)"
    },
    {
      "repo": "argo-cd",
      "file": "util/db/secrets.go",
      "breaking_patterns": ["direct_index_write"],
      "code_evidence": ["secret.Labels[common.LabelKeySecretType] = secretType"],
      "severity": "compile_error",
      "suggested_fix": "secret.Labels.Set(common.LabelKeySecretType, secretType)"
    },
    {
      "repo": "argo-cd",
      "file": "controller/clusterinfoupdater.go",
      "breaking_patterns": ["direct_index_read", "direct_index_write"],
      "code_evidence": ["cluster.Labels[key]"],
      "severity": "compile_error",
      "suggested_fix": "cluster.Labels.Get(key) / cluster.Labels.Set(key, val)"
    },
    {
      "repo": "argo-cd",
      "file": "controller/appcontroller.go",
      "breaking_patterns": ["direct_index_read"],
      "code_evidence": ["app.Labels[key]"],
      "severity": "compile_error",
      "suggested_fix": "app.Labels.Get(key)"
    },
    {
      "repo": "argo-cd",
      "file": "util/settings/settings.go",
      "breaking_patterns": ["direct_index_read"],
      "code_evidence": ["secret.Labels[key]"],
      "severity": "compile_error",
      "suggested_fix": "secret.Labels.Get(key)"
    },
    {
      "repo": "argo-cd",
      "file": "util/settings/cluster_informer.go",
      "breaking_patterns": ["direct_index_read"],
      "code_evidence": ["secret.Labels[key]"],
      "severity": "compile_error",
      "suggested_fix": "secret.Labels.Get(key)"
    },
    {
      "repo": "cert-manager",
      "file": "pkg/controller/acmeorders/selectors/labels.go",
      "breaking_patterns": ["direct_index_read", "range_iteration"],
      "code_evidence": ["obj.Labels[key]", "range obj.Labels"],
      "severity": "compile_error",
      "suggested_fix": "obj.Labels.Get(key) / obj.Labels.Entries()"
    },
    {
      "repo": "cert-manager",
      "file": "pkg/controller/certificates/issuing/internal/secret.go",
      "breaking_patterns": ["direct_index_read", "direct_index_write"],
      "code_evidence": ["secret.Labels[key]"],
      "severity": "compile_error",
      "suggested_fix": "secret.Labels.Get(key) / secret.Labels.Set(key, val)"
    },
    {
      "repo": "cert-manager",
      "file": "internal/controller/certificates/policies/checks.go",
      "breaking_patterns": ["direct_index_read"],
      "code_evidence": ["secret.Labels[key]"],
      "severity": "compile_error",
      "suggested_fix": "secret.Labels.Get(key)"
    },
    {
      "repo": "external-secrets",
      "file": "pkg/controllers/externalsecret/externalsecret_controller.go",
      "breaking_patterns": ["map_initialization", "direct_index_write"],
      "code_evidence": ["secretPartial.Labels = make(map[string]string)", "secretPartial.Labels[esv1.LabelManaged] = esv1.LabelManagedValue"],
      "severity": "compile_error",
      "suggested_fix": "secretPartial.Labels = NewLabelMap(); secretPartial.Labels.Set(esv1.LabelManaged, esv1.LabelManagedValue)"
    },
    {
      "repo": "external-secrets",
      "file": "pkg/controllers/webhookconfig/webhookconfig.go",
      "breaking_patterns": ["direct_index_read"],
      "code_evidence": ["obj.Labels[key]"],
      "severity": "compile_error",
      "suggested_fix": "obj.Labels.Get(key)"
    },
    {
      "repo": "prometheus",
      "file": "discovery/kubernetes/pod.go",
      "breaking_patterns": ["direct_index_write"],
      "code_evidence": ["tg.Labels[namespaceLabel] = lv(pod.Namespace)"],
      "severity": "compile_error",
      "suggested_fix": "tg.Labels.Set(namespaceLabel, lv(pod.Namespace))"
    },
    {
      "repo": "prometheus",
      "file": "discovery/kubernetes/endpointslice.go",
      "breaking_patterns": ["direct_index_read", "direct_index_write"],
      "code_evidence": ["ep.Labels[key]"],
      "severity": "compile_error",
      "suggested_fix": "ep.Labels.Get(key) / ep.Labels.Set(key, val)"
    },
    {
      "repo": "loki",
      "file": "operator/internal/controller/loki/lokistack_zone_labeling_controller.go",
      "breaking_patterns": ["range_iteration"],
      "code_evidence": ["for k, v := range pod.Labels"],
      "severity": "compile_error",
      "suggested_fix": "for k, v := range pod.Labels.Entries()"
    },
    {
      "repo": "loki",
      "file": "clients/pkg/logentry/stages/match.go",
      "breaking_patterns": ["range_iteration"],
      "code_evidence": ["range labels"],
      "severity": "compile_error",
      "suggested_fix": "range labels.Entries()"
    },
    {
      "repo": "loki",
      "file": "clients/pkg/logentry/stages/structuredmetadata.go",
      "breaking_patterns": ["range_iteration"],
      "code_evidence": ["range labels"],
      "severity": "compile_error",
      "suggested_fix": "range labels.Entries()"
    },
    {
      "repo": "opentelemetry-collector-contrib",
      "file": "processor/k8sattributesprocessor/internal/kube/client.go",
      "breaking_patterns": ["direct_index_read", "range_iteration"],
      "code_evidence": ["pod.Labels[key]", "range pod.Labels"],
      "severity": "compile_error",
      "suggested_fix": "pod.Labels.Get(key) / pod.Labels.Entries()"
    },
    {
      "repo": "opentelemetry-collector-contrib",
      "file": "receiver/kubeletstatsreceiver/internal/kubelet/metadata.go",
      "breaking_patterns": ["direct_index_read"],
      "code_evidence": ["pod.Labels[key]"],
      "severity": "compile_error",
      "suggested_fix": "pod.Labels.Get(key)"
    }
  ],

  "false_positives": [
    {
      "repo": "<REPO_NAME>",
      "file": "<FILE_PATH>",
      "why_not_affected": "<REASON — e.g. uses labels via controller-runtime client.MatchingLabels() helper which abstracts map access>"
    }
  ],

  "impact_summary": {
    "total_impacted_files": 18,
    "total_false_positives": 0,
    "repos_affected": ["argo-cd", "cert-manager", "external-secrets", "prometheus", "loki", "opentelemetry-collector-contrib"],
    "by_pattern": {
      "direct_index_read": 11,
      "direct_index_write": 7,
      "range_iteration": 5,
      "map_initialization": 1,
      "map_literal_assignment": 0,
      "type_pass_to_func": 0,
      "map_comparison": 0,
      "nil_check_as_map": 0
    },
    "by_severity": {
      "compile_error": 18,
      "runtime_behavior_change": 0,
      "test_failure": 0
    }
  }
}
